title,price,rating,oprice,brand
USM ID116 Smart Watch Smart Bracelet Fitness Tracker Color Screen Smartwatch Heart Rate Blood Pressure Pedometer Sleep Monitor  ,329,4.4,₹329,USM
"boAt Xtend Smartwatch Batman Edition with Alexa Built-in, 1.69” HD Display, Multiple Watch Faces, Stress Monitor, Heart & SpO2 Monitoring, 14 Sports Modes, Sleep Monitor, 5 ATM(Knight Black)  ","1,299",4.1,"₹1,299",boAt
"boAt Flash Edition Smart Watch with Activity Tracker, Multiple Sports Modes, 1.3"" Screen, 170+ Watch Faces, Sleep Monitor, Gesture, Camera & Music Control, IP68 & 7 Days Battery Life(Lightning Black)  ","1,499",4.0,"₹1,499",boAt
"Noise ColorFit Pulse Grand Smart Watch with 1.69""(42.9cm) HD Display, 60 Sports Modes, 150 Watch Faces, Fast Charge, Spo2, Stress, Sleep, Heart Rate Monitoring & IP68 Waterproof (Champagne Grey)  ","1,299",4.0,"₹1,299",Noise
Digital Sports Multi Functional Black Dial Watch for Mens Boys -315RED  ,284,3.8,₹284,Shocknshop
Silicone Strap Analog Wrist Watch for Men (Black/Blue/Red) | LD-BK054  ,397,4.0,₹397,LOUIS DEVIN
"Fire-Boltt Ninja Call Pro Plus 1.83"" Smart Watch with Bluetooth Calling, AI Voice Assistance, 100 Sports Modes IP67 Rating, 240 * 280 Pixel High Resolution  ","1,799",4.3,"₹1,799",Fire-Boltt
SHREENOVA® ID116 Plus Bluetooth Fitness Smart Watch for Men Women and Kids Activity Tracker (Black)  ,399,3.1,₹399,Generic
"boAt Wave Prime47 Smart Watch with 1.69"" HD Display, 700+ Active Modes, ASAP Charge, Live Cricket Scores, Crest App Health Ecosystem, HR & SpO2 Monitoring(Matte Black)  ","1,199",3.4,"₹1,199",boAt
"Tokdis MX-1 Pro Bluetooth Calling Smartwatch - 1.69” LCD Display, Multiple Watch Faces, Sleep Monitor, Heart & SpO2 Monitoring, Multiple Sports Modes  ",799,3.1,₹799,Tokdis
Analog Day Date Functioning Stainless Steel Chain Watch for Men  ,319,3.8,₹319,TIMEWEAR
"Digital 24 Images Projector Watch for Kids Boys Watch, Diwali Gift, Birthday Return Gift, Best Digital Toy Watch for Boy's & Girl's BG-906  ",289,4.1,₹289,ADAMO
"boAt Newly Launched Wave Armour with 1.83” HD Display, Bluetooth Calling, Rugged Design, HR, SpO2 & Sleep Monitoring, Multiple Sports Modes, Multiple Watch Faces(Olive Green)  ","2,199",4.6,"₹2,199",boAt
"boAt Flash Edition Smart Watch with Activity Tracker, Multiple Sports Modes, 1.3"" Screen, 170+ Watch Faces, Sleep Monitor, Gesture, Camera & Music Control, IP68 & 7 Days Battery Life(Galaxy Blue)  ","1,499",4.0,"₹1,499",boAt
"Hammer Ace 3.0 Bluetooth Calling Smart Watch with Largest 1.85"" IPS Display, Dual Mode, Spo2, Heart Rate, Strong Metallic Body & Skin Friendly Strap (Black)  ","1,499",4.5,"₹1,499",Hammer
"Fire-Boltt Gladiator 1.96"" Biggest Display Smart Watch with Bluetooth Calling, Voice Assistant &123 Sports Modes, 8 Unique UI Interactions, SpO2, 24/7 Heart Rate Tracking, Rs 100 Off on UPI  ","2,499",4.0,"₹2,499",Fire-Boltt
"Bouncefit D20 Y68 Fitness Band Smartwatch – Single Touch Interface, Water Resistant, Workout Modes, Quick Charge Sports Smartwatch for Boys and Girls – Jet Black  ",480,3.0,₹480,Bouncefit
IBS Ultra Seris 8 Smart Watch Men Two Watch NFC Door Unlock Smartwatch Bluetooth Call Wireless Charge Fitness Bracelet (Ultra T-800 Orange)  ,"1,799",3.2,"₹1,799",IBS
Vintage Series Digital Dial Men's & Women's Watch  ,299,2.7,₹299,MIVAAN
"Noise Pulse Go Buzz Smart Watch with Advanced Bluetooth Calling, 1.69"" Display, 150+ Cloud Watch Face, SPo2, Heart Rate Tracking, 100 Sports Mode with Auto Detection, Longer Battery (Midnight Blue)  ","1,699",4.1,"₹1,699",Noise
Analog Day & Date Display Wrist Watch for Men & Boys (Black)  ,299,3.6,₹299,Matrix
Krishna Analog Analog Watch - for Boys & Girls  ,224,5.0,₹224,Generic
"Fire-Boltt Ring 3 Smart Watch 1.8"" Biggest Display Advanced Bluetooth Calling Chip, Voice Assistance,118 Sports Modes, in Built Calculator & Games, SpO2, Heart Rate Monitoring  ","1,999",4.2,"₹1,999",Fire-Boltt
"Smart Watch for men women boys 1.3"" OLED HD Display, Multiple watch Faces, SpO2 Monitoring, Sleep Monitor for Boys, Girls, Mens, Women & Kids for all Smartphones (ID 116 Plus Black) (ID116 Black)  ",432,4.6,₹432,LOCREST
Kids Black Dial Digital Watch Date and Time Watch with M4 White Band Watch for Kids Boys and Girls (Pack of-2) (White) (White)  ,299,3.3,₹299,Oculus
Stainless Steel Watch Series Analogue Men's Watch (Black Dial Mens Long Colored Strap) -W219  ,285,3.8,₹285,Shocknshop
WT005 Stainless Steel Chain Analog Wrist Watch for Men  ,359,3.9,₹359,LOUIS DEVIN
Simple Sport Digital Men’s Military Watches Electronic LED Time Black Wrist Watch  ,449,3.8,₹449,Shocknshop
Analog Boy's & Men's Watch (Blue Dial Blue Colored Strap)  ,266,3.6,₹266,REDUX
Digital Watch Shockproof Multi-Functional Automatic Black Color Strap Waterproof Digital Sports Watch for Mens Kids Watch for Boys Watch for Men Pack of 1 Watch Water Resistance Digital Watch  ,189,3.8,₹189,SELLORIA
Analogue - Digital Men's Watch (Black Dial Black Colored Strap)  ,799,3.8,₹799,V2A
Analogue Black Dial Men's Watch - SS-GR918-BLK-BLK  ,149,2.5,₹149,SWISSTYLE
Digital Dial Men's & Women's Watch(AB206-VSD)  ,299,2.3,₹299,CERO
"Fire-Boltt Gladiator 1.96"" Biggest Display Smart Watch with Bluetooth Calling, Voice Assistant &123 Sports Modes, 8 Unique UI Interactions, SpO2, 24/7 Heart Rate Tracking, Rs 100 Off on UPI  ","2,499",4.0,"₹2,499",Fire-Boltt
Multi Dial Chronograph Luxury Quartz Analog Watch for Men  ,339,3.7,₹339,SWADESI STUFF
"Noise ColorFit Pulse Grand Smart Watch with 1.69""(4.2cm) HD Display, 60 Sports Modes, 150 Watch Faces, Fast Charge, Spo2, Stress, Sleep, Heart Rate Monitoring & IP68 Waterproof (Lime Green)  ","1,299",4.0,"₹1,299",Noise
Analog Men's Watch (Multicolor Dial Multi Colored Strap)  ,129,3.1,₹129,hamt
"boAt Matrix Smart Watch with 1.65” AMOLED Display, Always On Mode, Slim Premium Design, Heart Rate & SpO2 Monitoring, Health Ecosystem & Multiple Sports Modes, 3ATM & 7 Days Battery Life(Pitch Black)  ","1,499",3.9,"₹1,499",boAt
Premium Casual Stylish Watch | Luxury Working Chronograph Watch for Men | Water-Resistant Branded Men's Wrist Watch with Stopwatch & Date Display - Timegrapher Red Leather Watch  ,"1,109",3.0,"₹1,109",Sylvi
New Edition i7 Pro Max All in One Series 7 Smart Watch with Fitness Tracker Heart Monitor Men Women Smart Watch Black  ,619,3.2,₹619,Generic
New LED Square Digital Watch for Boys & Girls  ,99,2.7,₹99,RPS FASHION WITH DEVICE OF R
"SHREENOVA XA Smart Watch for Men & Women Latest Bluetooth 1.3"" LED with Daily Activity Tracker, Heart Rate Sensor,Sports Gym Watch for All Boys & Girls - Black  ",295,3.0,₹295,Generic
Analog Men's Watch (Brown Dial Brown Colored Strap)  ,299,3.6,₹299,SWISSTONE
"OLICOM M1 Smart Watch Id-116 Bluetooth Smartwatch Wireless Fitness Band for Boys, Girls, Men, Women & Kids | Sports Gym Watch for All Smart Phones I Heart Rate and spo2 Monitor  ",499,3.6,₹499,OLICOM
The Watch (Fourteen Tales of Thirteen Covens Book 5)  ,0,5.0,₹0,Audrey Brice
"boAt Xtend Smart Watch with Alexa Built-in, 1.69” HD Display, Multiple Watch Faces, Stress Monitor, HR & SpO2 Monitoring, 14 Sports Modes, Sleep Monitor, 5 ATM & 7 Days Battery Life(Deep Blue)  ","1,799",4.1,"₹1,799",boAt
Brand - A Digital Watch Shockproof Multi-Functional Automatic 5 Color Army Strap Waterproof Digital Sport's Watches for Men's Kids Watch for Boys - Watches for Men  ,275,3.8,₹275,Acnos
"PTron Newly Launched Force X10 Bluetooth Calling Smartwatch with 1.7"" Full Touch Color Display, Real Heart Rate Monitor, SpO2, Watch Faces, 5 Days Runtime, Fitness Trackers & IP68 Waterproof (Pink)  ","1,099",3.2,"₹1,099",pTron
"pTron Force X12S Bluetooth Calling Smartwatch, 1.85"" Full Touch HD Display, Functional Crown, Real Heart Rate Monitor, SpO2, Watch Faces, 5 Days Battery Life, Fitness Trackers & IP68 Waterproof (Pink)  ","1,199",3.2,"₹1,199",pTron
"OLICOM M1 Smart Watch Id-116 Bluetooth Smartwatch Wireless Fitness Band for Boys, Girls, Men, Women & Kids | Sports Gym Watch for All Smart Phones I Heart Rate and spo2 Monitor  ",499,3.6,₹499,OLICOM
LED Digital Watch Good Looking Black Watch for Boys & Girls (Black Color)  ,95,2.9,₹95,Generic
"boAt Xtend Smart Watch with Alexa Built-in, 1.69” HD Display, Multiple Watch Faces, Stress Monitor, HR & SpO2 Monitoring, 14 Sports Modes, Sleep Monitor, 5 ATM & 7 Days Battery Life(Deep Blue)  ","1,799",4.1,"₹1,799",boAt
Analog Women's Watch (Blue Dial Silver Colored Strap).  ,327,4.0,₹327,SWISSTONE
Analogue Men's Watch(Gold Dial Silver Colored Strap)-S1089-2  ,"4,099",4.0,"₹4,099",FORSINING
Karishma Analog Black Dial Men's Watch-NL1636SM01  ,"1,615",4.1,"₹1,615",Titan
Neo Analog Dial Men's Watch  ,"4,194",4.3,"₹4,194",Titan
Diamond Studded Stylish Analogue Watch with Rose Gold Dot Bracelet for Girls & Women  ,240,3.8,₹240,ZUPERIA
Analogue Silver Dial Day and Date Men's Boy's Watch - Dexter0507  ,241,3.4,₹241,Espoir
"AYL Smart Watch New Generation for You ID116 Touchscreen Android Smart Watch Bluetooth Smartwatch with Heart Rate Sensor and Basic Functionality for All Women, Men, Boys & Girls - Black  ",499,3.4,₹499,AYL
Axial Digital Black Dial Men's Watch-DZT2017  ,"10,397",3.8,"₹10,397",Diesel
Analog Dial Men's Watch  ,"1,894",4.2,"₹1,894",Titan
"PTron Newly Launched Force X10 Bluetooth Calling Smartwatch with 1.7"" Full Touch Color Display, Real Heart Rate Monitor, SpO2, Watch Faces, 5 Days Runtime, Fitness Trackers & IP68 Waterproof (Pink)  ","1,099",3.2,"₹1,099",pTron
LED Digital Sports Multi Functional Black Dial Watch for Mens Boys -W1257  ,449,3.4,₹449,Shocknshop
"MARVIK Smart Watch D116 for Xiaomi Mi Note 10 Smart Watch LED with Activity Tracker, Heart Rate Sensor, Sleep Monitor and Basic Functionality for All Boys Girls  ",449,3.1,₹449,MARVIK
Brand - Analogue Men's Watch (Black Dial Multi Colored Strap) (1.Gold)  ,295,3.7,₹295,Acnos
RPM Analog Grey Dial Men's Watch-NN77031SL03/NP77031SL03  ,"1,699",4.1,"₹1,699",Sonata
Square Multi DIAL Analog Silicon Strap ADDI Stylish Designer Analog Watch - for Boys  ,189,3.5,₹189,SWADESI STUFF
"AYL Waterproof D-20 Touch Screen Smart Watch Bluetooth Smartwatch with Blood Pressure Tracking, Heart Rate Sensor and Basic Functionality for All Women and Girls (Pink)  ",470,3.3,₹470,AYL
Multi Functional Sports Digital Multicolor Dial Men's Watch  ,199,3.6,₹199,ASGARD
"Smart Watch for men women boys 1.3"" OLED HD Display, Multiple watch Faces, SpO2 Monitoring, Sleep Monitor for Boys, Girls, Mens, Women & Kids for all Smartphones (ID 116 Plus Black) (ID116 Black)  ",432,4.6,₹432,LOCREST
"Fire-Boltt Ninja 3 1.83"" Display Smartwatch Full Touch with 100+ Sports Modes with IP68, Sp02 Tracking, Over 100 Cloud Based Watch Faces  ","1,299",4.2,"₹1,299",Fire-Boltt
Analog Men's Watch ( Dial Blue Colored Strap)  ,"2,695",4.1,"₹2,695",CURREN
Analog Men's Watch  ,"1,298",4.1,"₹1,298",TIMEX
Analog Dial Men's Watch  ,"1,849",4.4,"₹1,849",Titan
"MARVIK Smart Watch D116 for Xiaomi Mi Note 9 Smart Watch Bluetooth SmartWatch with Activity Tracker, Heart Rate Sensor, Sleep Monitor and Basic Functionality for All Boys & Girls  ",449,3.1,₹449,MARVIK
Watches for Men Round Numerical Dial |Analogue Quartz Movemnet Mens Watch|Long Battery Life|Stainless Steel Adjustable Bracelet Black Chain with Long Lasting Polish| Watches for Boys  ,249,4.4,₹249,IIK COLLECTION
VMBS A1 Smart Watch Mobile Inbuild Camera Supporting 4G/5G Sim Smartwatch for Phone  ,990,2.5,₹990,VMBS
"Fire-Boltt Ring 3 Smart Watch 1.8"" Biggest Display Advanced Bluetooth Calling Chip, Voice Assistance,118 Sports Modes, in Built Calculator & Games, SpO2, Heart Rate Monitoring  ","1,999",4.2,"₹1,999",Fire-Boltt
Analog Dial Black Metal Strap Watch Series Watches for Men Watch for Man and Watch for Boys  ,284,3.5,₹284,The Shopoholic
"Noise ColorFit Ultra Buzz Bluetooth Calling Smart Watch with 1.75"" HD Display, 320x385 px Resolution, 100 Sports Modes, Stock Market Info Smartwatch for Men & Women (Champagne Grey)  ","1,999",4.1,"₹1,999",Noise
Lapster USB all types smartwatch charger cable for boat watch charger & boat xtend watch charger & boat storm watch charger- All 2 Pin Watch (Cable Only)  ,113,3.4,₹113,LS LAPSTER Quality Assured
Analogue Blue Black and Brown Color Dial Day and Date Boy's and Men's Watch  ,249,3.7,₹249,Espoir
i8 Pro Max Touch Screen Bluetooth Smartwatch with Activity Tracker Compatible with All 3G/4G/5G Android & iOS Smartphones - Black  ,919,2.9,₹919,Generic
"Redmi Watch 2 Lite - 3.94 cm Large HD Edge Display, Multi-System Standalone GPS, Continuous SpO2, Stress & Sleep Monitoring, 24x7 HR, 5ATM, 120+ Watch Faces, 100+ Sports Modes, Women's Health, Blue  ","2,499",3.9,"₹2,499",Redmi
"Watch City Brand Analogue Watch Waterproof Sport Look 7 Color Silicone Strap Watch Multicolor Waterproof Sport Watch for Men's Kids, Boys, Men  ",335,3.8,₹335,
"Waterproof D20 Touchscreen Smart Watch Bluetooth Smartwatch with Blood Pressure Tracking, Heart Rate Sensor and Basic Functionality for All Women and Men  ",332,2.5,₹332,Generic
Black Dial Analogue Watch for Men Pack of 1 (FULLBLKPAYDU)  ,265,3.6,₹265,Acnos
"Digital 24 Images Projector Watch for Kids Boys Watch, Diwali Gift, Birthday Return Gift, Best Digital Toy Watch for Boy's & Girl's BG-906  ",289,4.1,₹289,ADAMO
Silicone Strap Black Dial Watch for Men | Watches for Boys | Stylish Analog Watches for Men  ,"1,499",5.0,"₹1,499",Sylvi
New Fastrack Reflex Beat+ 1.69” UltraVU Display|500 Nits Brightness|60 Sports Modes|24*7 Heart Rate Monitor|SpO2 Monitor|Sleep Tracker|IP68 Water Resistant|Music & Camera Control  ,"1,694",3.9,"₹1,694",Fastrack
Premium Casual Stylish Watch | Luxury Working Chronograph Watch for Men | Water-Resistant Branded Men's Wrist Watch with Stopwatch & Date Display - Timegrapher Red Leather Watch  ,"1,109",3.0,"₹1,109",Sylvi
Venus Digital Grey Dial Men's Watch-NL7982PP01/NM7982PP01  ,499,4.1,₹499,SF
Analog Silver Dial Men's Watch-TW0TG6502  ,"1,747",4.3,"₹1,747",TIMEX
"Fire-Boltt Astro 1.78"" AMOLED Display Smartwatch, Always On Display, Bluetooth Calling with AI Voice, 110+ Sports Modes, Rotating Button Technology, High Resolution of 368 * 448 Pixels  ","2,999",4.1,"₹2,999",Fire-Boltt
Analog Dial Men's Watch  ,"1,998",4.2,"₹1,998",Titan
"boAt Wave Lite Smartwatch with 1.69 Inches(4.29cm) HD Display, Heart Rate & SpO2 Level Monitor, Multiple Watch Faces, Activity Tracker, Multiple Sports Modes & IP68 (Scarlet Red)  ","1,499",3.9,"₹1,499",boAt
Analog White Dial Men's Watch-HB611251ABR  ,"7,440",4.1,"₹7,440",Mathey-Tissot
"Hammer Pulse Ace Pro Bluetooth Calling Smartwatch with SpO2 & 1.81” Aluminium Alloy Body with Blood Oxygen Monitoring, Heart Rate, Full Touch & Multiple Watch Faces with Customization (Black)  ","1,798",3.8,"₹1,798",Hammer
Watch: A Novel  ,939.,4.6,₹939.86,Keith Buckley
"Kids Sports Digital Watch, Multi Function Digital Kids Watches Waterproof LED Light Wristwatches for Boys Girls - 1451  ",840,4.2,₹840,SKMEI
"SENS NUTON 1 with 1.7 IPS Display, Orbiter, 5ATM & 150+ Watch Faces & Free Additional Strap (Royal Silver)  ","1,099",3.9,"₹1,099",SENS
Analogue Men's Watch (Black Dial Black Colored Strap)  ,249,3.7,₹249,JAGER
"New LED Watch for Boys, Girls and Kids Digital Black Dial Led Watch for Kids Unisex Birthday Gift Digital Watch  ",100,3.9,₹100,BITZAG
Classics Analog White Dial Women's Watch-B300  ,625,4.2,₹625,TIMEX
Multi Function Day and Date Alarm Kids Digital Sports Watch for Boys & Girls  ,339,3.6,₹339,SWADESI STUFF
"CrossBeats Ignite GRIT Smart Watch, 1.83 AMOLED Display with Advanced Bluetooth Calling, Rotating Crown,AI Health Sensors, 150+ Sports Modes, 250+Watch Faces, in-Built Games, 15 Days Battery-Black  ","2,999",4.3,"₹2,999",CrossBeats
Analog Black Dial Men's Watch-TI000R41500  ,"1,208",4.0,"₹1,208",TIMEX
Analogue Men's Watch (Silver Dial Silver Colored Strap)  ,322,3.9,₹322,AUREX
Brishti Super-Hero Multicolored Glowing Light Digital Wrist Watch for Kid's (Best Return Gift for Boy's)  ,299,3.8,₹299,Brishti
"Samsung Galaxy Watch4 LTE (4.4 cm, Black, Compatible with Android only)  ","18,999",4.3,"₹18,999",Samsung
Analog Multi-Colour Dial Children's Watch-NLC3030PP05/NPC3030PP05W  ,845,4.3,₹845,Zoop
"Gen 5E Smartwatch with AMOLED Screen, Wear OS by Google, Built-in Speaker for Phone Calls, Google Assistant, SpO2, GPS, NFC, Wellness Features and Smartphone Notifications  ","14,794",3.9,"₹14,794",Fossil
NOVA Skeleton Automatic Watch Mechanical Wrist Watch for Men Bezel Screw Design Silicone Band Self-Wind Business Watch for Men  ,"3,490",4.2,"₹3,490",ALTURA
"CrossBeats Ignite S5 Advanced AI ENC BT Calling Smartwatch, 1.96” Super AMOLED Anti-Glare Screen, Always on Display, Calculator, 500+ Watch Faces, 360 Degree Health Tracking, Fast Charge (Silver)  ","4,999",4.1,"₹4,999",CrossBeats
"CrossBeats Newly launched Ignite S5 Advanced AI ENC BT Calling Smartwatch, 1.96” Super AMOLED Anti-Glare Screen, Always on Display, SnapCharge™ Calculator, 500+ Watch Faces, AI Health Feature (Black)  ","4,999",4.1,"₹4,999",CrossBeats
Boy's Avenger Printed Analog Watch and King Bracelet Combo (Black)  ,249,3.6,₹249,CERO
"Apple Watch SE (2nd Gen) [GPS 40 mm] Smart Watch w/Midnight Aluminium Case & Midnight Sport Band. Fitness & Sleep Tracker, Crash Detection, Heart Rate Monitor, Retina Display, Water Resistant  ","29,400",4.6,"₹29,400",Apple
Analogue White Slim Dial Luxurious Blue/Red Fabric Strap Fashion Men's Wrist Watch  ,269,3.7,₹269,FRIEDRICH
"boAt Blaze Smart Watch with 1.75” HD Display, Fast Charge, Apollo 3 Blue Plus Processor, 24x7 Heart Rate & SpO2 Monitor, Multiple Watch Faces, Multiple Sports Modes & 7 Days Battery Life(Deep Blue)  ","1,499",3.8,"₹1,499",boAt
Black dial-case and Black Leather Watch for Men Pack of - 1  ,245,3.4,₹245,Acnos
Beyond Gold Analog Black Dial Men's Watch-NN77031KM03/NP77031KM03  ,"2,085",4.3,"₹2,085",Sonata
Bikers Analog White Dial Men's Watch-NL3022SL01/NP3022SL01  ,"3,595",4.2,"₹3,595",Fastrack
Analog Champagne Dial Women's Watch-NL87018YM01/NP87018YM01  ,825,4.2,₹825,Sonata
Chronograph Design Multi Analog Combo Watches for Men and Watches for Boys Pack of 3  ,355,3.5,₹355,Acnos
Fastrack Reflex Hello Smart Watch with BT Calling|Bright HD Display|AI Voice Assistant|50+ Sports Modes|100+ Watchfaces|BP Monitor|24x7 HRM| SpO2|Upto 5 Day Battery|Camera & Music Control|IP68  ,"3,994",3.8,"₹3,994",Fastrack
Analog Black Dial Men's Watch-CUR007  ,,3.8,,CURREN
Essentials Analog Silver Dial Men's Watch NM77082SL01W/NN77082SL01W  ,799,4.3,₹799,Sonata
Shhors Collection Quartz Movement Digital Black Dial Sports Alarm Unisex Watch  ,283,4.1,₹283,Primeshop
Classics Analog White Dial Men's Watch-A300  ,618,4.2,₹618,TIMEX
Analog Women's Watch  ,"1,354",4.3,"₹1,354",Fastrack
Analog Black Dial Men's Watch NM7987YL03W/NN7987YL03W  ,649,4.1,₹649,Sonata
Zaha New Generation Digital Square Watch for Boys & Girls & Kids (Red)  ,139,5.0,₹139,Generic
Riley Analog Rose Gold Dial Women's Watch - ES2811  ,"10,995",4.2,"₹10,995",Fossil
"APCSA Original New Series 7 D20 Bluetooth Wireless Smart Watch, Fitness Band for Boys, Girls, Men, Women & Kids | Sports Watch for All Smart Phones I Heart Rate and BP Monitor ( Pink )  ",498,3.0,₹498,APCSA
Analog-Digital Gold Round Dial Men's Casual Watch-77070PP08  ,"2,899",3.7,"₹2,899",SF
Chronograph Men's Watch (Black Dial)  ,"12,995",4.3,"₹12,995",Armani Exchange
Analog White Dial Men's Watch-NL1585SL07  ,"1,995",4.3,"₹1,995",Titan
Analog Silver Dial Men's Watch-TW000U908  ,"2,096",3.9,"₹2,096",TIMEX
Sporty Digital Grey Dial Men's Watch-NL77043PP02/NP77043PP02  ,549,4.0,₹549,SF
Reflex Vox Smartwatch|Alexa Built-in|Bright HD Display|Upto 10 Days Battery|5 ATM Water Resistance|Multiple Sports Modes|100+ Watchfaces|24x7 HRM|Sp02|Stress Monitor|Camera & Music Control  ,"1,994",3.9,"₹1,994",Fastrack
Brand A Army Shockproof Waterproof Digital Sports Black Sunglass with Black Baseball Cap Watch for Mens Kids Sports Watch with Cap for Boys - Military Army Watch for Men  ,321,3.7,₹321,SELLORIA
"DIZO Watch D2 Power (by realme TechLife) – Large 1.91"" Superlight, Single Chipset Bluetooth Calling Smartwatch with Smart Swipe, 150+Stylish Watch Faces and 10 Day Battery (Steel Grey)  ","1,799",3.7,"₹1,799",DIZO
Analog White Dial Men's Watch-TW000U933  ,"1,598",4.1,"₹1,598",TIMEX
IZU Kids Cartoon Character Waterproof Superhero Theme Waterproof Touch Button Silicone Smart Digital LED Band Bracelet Watch (Black) -Pack of 4  ,499,3.2,₹499,IZU
"Redmi Watch 2 Lite - 3.94 cm Large HD Edge Display, Multi-System Standalone GPS, Continuous SpO2, Stress & Sleep Monitoring, 24x7 HR, 5ATM, 120+ Watch Faces, 100+ Sports Modes, Women's Health, Blue  ","2,499",3.9,"₹2,499",Redmi
Analogue Men's Watch (Silver Dial Silver Colored Strap)  ,322,3.9,₹322,AUREX
Analog Black Dial Men's Watch-TW000U934  ,"2,160",4.2,"₹2,160",TIMEX
The Watch (Red Book 1)  ,446,4.5,₹446,Amanda Witt
"PTron Force X12N 1.85"" Full Touch HD Display Bluetooth Calling Smartwatch, Functional Crown, 580 NITS Brightness, HR, SpO2, Watch Faces, Inbuilt Games, 5 Days Battery Life & IP68 Waterproof (Blue)  ","1,549",3.8,"₹1,549",pTron
Luxury Analog Men's Watch (Black Dial Black Colored Strap)  ,649,3.6,₹649,LORENZ
Karishma Analog Black Dial Men's Watch-NM9151SM02 / NL9151SM02  ,"1,895",4.1,"₹1,895",Titan
Analog Multi-Colour Dial Children's Watch-NLC3030PP05/NPC3030PP05W  ,845,4.3,₹845,Zoop
"(Renewed) Fire-Boltt Ninja Call Pro Dual Chip Bluetooth Calling Smartwatch, AI Voice Assistance 1.69 HD Display, 100 Sports Modes, with SpO2 & Heart Rate Monitoring, 240*280 Pixel High Resolution  ","1,443",4.0,"₹1,443",Amazon Renewed
Analog-Digital Black Dial Men's Watch-NL77070PP06/NP77070PP06  ,"2,899",4.2,"₹2,899",SF
"PTron Newly Launched Force X11P Bluetooth Calling Smartwatch with 1.3"" Full Touch Display, Heart Rate Tracking, SpO2, 100s of Watch Faces, 5 Days Runtime, Fitness Trackers & IP68 Waterproof (Black)  ","1,299",3.4,"₹1,299",pTron
Digital Grey Dial Men's Watch-NL77072PP02/NP77072PP02  ,599,4.3,₹599,Sonata
Xtreme Gear Analog-Digital Grey Round Dial Men's Sport Watch-77070PP07  ,"2,899",4.1,"₹2,899",SF
"Smart 2 Fashion Smartwatch, 1.78” AMOLED Display with Premium Metal Body, Multiple Sports Modes with 100+ Watchfaces, Complete Health Suite with Stress Monitor, 7 Days Battery Life & 3 ATM  ","5,995",3.9,"₹5,995",Titan
NOVA Skeleton Automatic Watch Mechanical Wrist Watch for Men Bezel Screw Design Silicone Band Self-Wind Business Watch for Men  ,"3,490",4.2,"₹3,490",ALTURA
Analog Blue Dial Women's Watch-NL2574SM01/NP2574SM01  ,"1,795",4.3,"₹1,795",Titan
Boy's Avenger Printed Analog Watch and King Bracelet Combo (Black)  ,249,3.6,₹249,CERO
"Samsung Galaxy Watch4 LTE (4.4 cm, Black, Compatible with Android only)  ","18,999",4.3,"₹18,999",Samsung
Analogue White Slim Dial Luxurious Blue/Red Fabric Strap Fashion Men's Wrist Watch  ,269,3.7,₹269,FRIEDRICH
"DIZO Watch D2 Power (by realme TechLife) – Large 1.91"" Superlight, Single Chipset Bluetooth Calling Smartwatch with Smart Swipe, 150+Stylish Watch Faces and 10 Day Battery (Steel Grey)  ","1,799",3.7,"₹1,799",DIZO
Edifice Stopwatch Men's Chronograph EFR-539BK-1AVUDF (EX187)  ,,4.0,,Casio
Super Fibre Digital Grey Dial Men's Watch-NL87011PP04/NP87011PP04  ,600,4.2,₹600,Sonata
Black dial-case and Black Leather Watch for Men Pack of - 1  ,245,3.4,₹245,Acnos
Trendies Analog Black Dial Women's Watch-NL68006PP01/NP68006PP01  ,"2,050",4.0,"₹2,050",Fastrack
"Digital Watch for Men's & Boy's (Multicolored Silver Dial, Black Colored Strap)  ",419,3.8,₹419,Emartos
"boAt Blaze Smart Watch with 1.75"" HD Display, Fast Charge, Apollo 3 Blue Plus Processor, 24x7 Heart Rate & SpO2 Monitor, Multiple Watch Faces, Multiple Sports Modes & 7 Days Battery Life(Active Black)  ","1,999",3.8,"₹1,999",boAt
Zaha New Generation Digital Square Watch for Boys & Girls & Kids (Pink)  ,110,1.5,₹110,Generic
Analog Silver Dial Unisex's Watch-NL11418100BM01/NP11418100BM01  ,"3,125",4.3,"₹3,125",Sonata
Bikers Analog White Dial Men's Watch-NL3022SL01/NP3022SL01  ,"3,595",4.2,"₹3,595",Fastrack
Analog Black Dial Men's Watch-MTP-VT01L-1BUDF (A1615)  ,"2,405",4.3,"₹2,405",Casio
Chronograph Design Multi Analog Combo Watches for Men and Watches for Boys Pack of 3  ,355,3.5,₹355,Acnos
Analog Black Dial Men's Watch-NG38022PP03W / NG38022PP03C  ,795,4.4,₹795,Fastrack
Analog Gold Dial Women's Watch-DK11430-4  ,,4.2,,DANIEL KLEIN
"Newly Launched Maxima Max Pro Knight Bluetooth Calling smartwatch with 44.5mm Round Active Display of 550 Nits Brightness, Voice Assistant, HR & SpO2 Monitor,30+ Excercise Modes, inbuilt Games  ","2,499",3.5,"₹2,499",Maxima
Analog Black Dial Men's Watch-CUR007  ,,3.8,,CURREN
"Fire-Boltt Ninja Fit Smartwatch Full Touch 1.69 & 120+ Sports Modes with IP68, Multi UI Screen, Over 100 Cloud Based Watch Faces, Built in Games  ","1,299",4.2,"₹1,299",Fire-Boltt
Shhors Collection Quartz Movement Digital Black Dial Sports Alarm Unisex Watch  ,283,4.1,₹283,Primeshop
Sporty Digital Grey Dial Men's Watch-NL77043PP02/NP77043PP02  ,549,4.0,₹549,SF
Analog Women's Watch  ,"1,354",4.3,"₹1,354",Fastrack
Fundamentals Analog Brown Dial Men's Watch-NL38051SL02  ,"1,550",4.2,"₹1,550",Fastrack
New Fastrack Reflex Beat+ 1.69” UltraVU Display|500 Nits Brightness|60 Sports Modes|24*7 Heart Rate Monitor|SpO2 Monitor|Sleep Tracker|IP68 Water Resistant|Music & Camera Control  ,"1,694",3.9,"₹1,694",Fastrack
Zaha New Generation Digital Square Watch for Boys & Girls & Kids (Red)  ,139,5.0,₹139,Generic
"APCSA Smart Watch for Men & Women Latest Bluetooth 1.3"" LED with Daily Activity Tracker, Heart Rate Sensor, BP Monitor, Sports Gym Watch for All Boys & Girls - Pink  ",599,3.4,₹599,APCSA
"Apple Watch SE (GPS + Cellular, 44mm) - Space Grey Aluminium Case with Midnight Sport Band - Regular  ","35,900",4.6,"₹35,900",Apple
