title,price,rating,oprice,brand
Analog-Digital Gold Round Dial Men's Casual Watch-77070PP08  ,"2,899",3.7,"₹2,899",SF
Chronograph Men's Watch (Black Dial)  ,"12,995",4.3,"₹12,995",Armani Exchange
Analog White Dial Men's Watch-NL1639SL03  ,"1,995",4.1,"₹1,995",Titan
Analog Silver Dial Men's Watch-TW000U908  ,"2,096",3.9,"₹2,096",TIMEX
Black Round Diamond Dial with Latest Generation Purple & Rosegold Magnet Belt Analogue Watch for Women Pack of - 2 (DM-PURPLE-ROSEGOLD05)  ,345,3.8,₹345,Acnos
Essentials Analog White Dial Women's Watch-NM87020SL01W / NL87020SL01W/NP87020SL01W  ,749,4.2,₹749,Sonata
Digital Boy's and Girl's Watch DIGITAL-07 (Grey Dial Multicolour Strap)  ,199,3.6,₹199,ON TIME OCTUS
Analog White Dial Women's Watch NM8976YL02W / NL8976YL02W  ,649,4.1,₹649,Sonata
"Fire-Boltt Ninja 3 1.83"" Display Smartwatch Full Touch with 100+ Sports Modes with IP68, Sp02 Tracking, Over 100 Cloud Based Watch Faces  ","1,299",4.2,"₹1,299",Fire-Boltt
Zaha New Generation Digital Square Watch for Boys & Girls & Kids (Pink)  ,110,1.5,₹110,Generic
Analog White Dial Unisex's Watch-NG38021PP10W / NG38021PP10W  ,795,4.2,₹795,Fastrack
Economy 2013 Analog Black Dial Men's Watch-NL3099SM04/NP3099SM04  ,"2,795",4.0,"₹2,795",Fastrack
Analog Black Dial Men's Watch-MTP-VT01L-1BUDF (A1615)  ,"2,405",4.3,"₹2,405",Casio
Futuristic White Rosegold Dial Watch  ,749,4.0,₹749,Joker & Witch
Analog Black Dial Women's Watch NM8976YL03W/NN8976YL03W  ,675,4.1,₹675,Sonata
The Watch  ,0,4.0,₹0,Raitt Emmel Hall
Gen 6 Smartwatch Digital Black Dial Men's Watch-FTW4060  ,"24,995",5.0,"₹24,995",Fossil
Analog Multicolor Small Dial Men's Watch -NM7987SL01W / NL7987SL01W  ,"1,775",3.9,"₹1,775",Sonata
Essentials Analog Black Dial Men's Watch-NN77082SM01/NP77082SM01  ,899,4.3,₹899,Sonata
Gents Karishma Analog Brown Dial Men's Watch-NN1824KM01  ,"3,995",4.2,"₹3,995",Titan
Leather Strap Analog Wrist Watch for Women (Black/Brown/Red) - CK312  ,279,3.7,₹279,SWISSTONE
Bikers Analog White Dial Men's Watch-NL3022SL01/NP3022SL01  ,"3,595",4.2,"₹3,595",Fastrack
"Smart 2 Fashion Smartwatch, 1.78” AMOLED Display with Premium Metal Body, Multiple Sports Modes with 100+ Watchfaces, Complete Health Suite with Stress Monitor, 7 Days Battery Life & 3 ATM  ","5,995",3.9,"₹5,995",Titan
Analog Black Dial Men's Watch-TWTG80SMU04  ,"1,998",3.9,"₹1,998",TIMEX
Karishma Analog Black Dial Men's Watch-NK1578SM04 / NK1578SM04  ,"1,995",4.3,"₹1,995",Titan
"Fire-Boltt Ring Bluetooth Calling Smartwatch with SpO2 & 1.7” Metal Body with Blood Oxygen Monitoring, Continuous Heart Rate, Full Touch & Multiple Watch Faces (Grey)  ","2,250",4.1,"₹2,250",Fire-Boltt
Analog Boy's Watch (Multicolour Dial Multi Colored Strap)  ,149,3.6,₹149,RPS FASHION WITH DEVICE OF R
"Maxima Max Pro X4+ Rugged Bluetooth Calling Smart Watch 1.32"" Round Always on Premium Display with 360x360 px Resolution, AI Voice Assitant, Advance UI, 340 mah Big Battery, HR/SpO2, 150+ Watch Faces  ","2,499",3.7,"₹2,499",
Chronograph Design Multi Analog Combo Watches for Men and Watches for Boys Pack of 3  ,355,3.5,₹355,Acnos
Digital Grey Dial Men's Watch-NL77072PP02/NP77072PP02  ,599,4.3,₹599,Sonata
Unisex Swiss True High Tech Analogue Ceramic Watch (White)  ,"2,999",No reviews,"₹2,999",Maicrogear
Fundamentals Analog Brown Dial Men's Watch-NL38051SL02  ,"1,550",4.2,"₹1,550",Fastrack
Zaha New Generation Digital Square Watch for Boys & Girls & Kids (Sky)  ,149,1.9,₹149,Generic
"Fire-Boltt Eterno 1.99"" Largest Display, Bluetooth Calling Smartwatch with 1184mm Display Area, AI Voice Assistant, 120+ Sports Modes (Yoga) with Smart Split Screen to Toggle between functions, Gaming on the Wrist  ","2,499",4.2,"₹2,499",Fire-Boltt
Analog Gold Dial Women's Watch-DK11430-4  ,,4.2,,DANIEL KLEIN
Fundamentals Analog Grey Dial Women's Watch-NL68010SM04/NP68010SM04  ,"1,499",4.3,"₹1,499",Fastrack
Digital Boy's & Men's Watch (Multicolour Dial Multi Colored Strap)  ,231,3.9,₹231,ZUPERIA
Venus Digital Grey Dial Men's Watch-NL7982PP02  ,499,4.0,₹499,SF
Shhors Collection Quartz Movement Digital Black Dial Sports Alarm Unisex Watch  ,283,4.1,₹283,Primeshop
"Apple Watch Ultra [GPS + Cellular 49 mm] Smart Watch w/Rugged Titanium Case & Green Alpine Loop - Small. Fitness Tracker, Precision GPS, Action Button, Extra-Long BatteryLife, Brighter Retina Display  ","82,999",4.2,"₹82,999",Apple
Men Club Combo Pack of 3 Watches  ,369,4.0,₹369,RPS FASHION WITH DEVICE OF R
Spiderman Analog Black Dial Unisex's Watch-NNC4048PP15  ,935,4.5,₹935,Zoop
Casual Analog Black Dial Men's Watch-NL3121SM02/NP3121SM02  ,"1,750",4.2,"₹1,750",Fastrack
Analog-Digital Gold Round Dial Men's Casual Watch-77070PP08  ,"2,899",3.7,"₹2,899",SF
Premium Analogue Women Watch (Golden Dial Golden Colored Chain)  ,636,4.2,₹636,jainx
NOVA Skeleton Automatic Watch Mechanical Wrist Watch for Men Bezel Screw Design Silicone Band Self-Wind Business Watch for Men  ,"3,490",4.2,"₹3,490",ALTURA
"CrossBeats Ignite GRIT Smart Watch, 1.83 AMOLED Display with Advanced Bluetooth Calling, Rotating Crown,AI Health Sensors, 150+ Sports Modes, 250+Watch Faces, in-Built Games, 15 Days Battery-Pink  ","2,999",4.3,"₹2,999",CrossBeats
Analog Black Dial Men's Watch-CUR007  ,,3.8,,CURREN
Chronograph Men's Watch (Black Dial)  ,"12,995",4.3,"₹12,995",Armani Exchange
"Apple Watch SE (2nd Gen) [GPS 44 mm] Smart Watch w/Starlight Aluminium Case & Starlight Sport Band. Fitness & Sleep Tracker, Crash Detection, Heart Rate Monitor, Retina Display, Water Resistant  ","31,900",4.6,"₹31,900",Apple
Minimalist Analog Blue Dial Men's Watch-FS5942  ,"11,995",3.8,"₹11,995",Fossil
Machine Analog Black Dial Men's Watch-FS4931I  ,"9,036",4.3,"₹9,036",Fossil
Casual Analog Black Dial Men's Watch-NL3121SM02/NP3121SM02  ,"1,750",4.2,"₹1,750",Fastrack
Premium Analogue Women Watch (Golden Dial Golden Colored Chain)  ,636,4.2,₹636,jainx
Analog Multicolor Small Dial Men's Watch -NM7987SL01W / NL7987SL01W  ,"1,775",3.9,"₹1,775",Sonata
"Apple Watch SE (2nd Gen) [GPS 44 mm] Smart Watch w/Starlight Aluminium Case & Starlight Sport Band. Fitness & Sleep Tracker, Crash Detection, Heart Rate Monitor, Retina Display, Water Resistant  ","31,900",4.6,"₹31,900",Apple
Zaha New Generation Digital Square Watch for Boys & Girls & Kids (Red)  ,139,5.0,₹139,Generic
Machine Analog Black Dial Men's Watch-FS4931I  ,"9,036",4.3,"₹9,036",Fossil
Analog Blue Dial Women's Watch-TW000X215  ,"2,778",4.4,"₹2,778",TIMEX
"New Titan Talk Smart Watch|BT Calling|1.39""AMOLED Display|Immersive 454x454 Resolution|Music Storage|TWS Connect|AI Voice|Multisport Modes  ","9,994",3.8,"₹9,994",Titan
Shhors Collection Quartz Movement Digital Black Dial Sports Alarm Unisex Watch  ,283,4.1,₹283,Primeshop
Analog Gold Dial Men's Watch NM7987YL01W/NN7987YL01W/NP7987YL01W  ,625,4.1,₹625,Sonata
"Watches: The History of Time,: The Complete Guide to Servicing And Repairing Your Timepiece  ",0,3.4,₹0,Samuel Johnson
Analog Dial Women's Watch  ,"2,387.",4.3,"₹2,387.09",French Connection
"CrossBeats Ignite GRIT Smart Watch, 1.83 AMOLED Display with Advanced Bluetooth Calling, Rotating Crown,AI Health Sensors, 150+ Sports Modes, 250+Watch Faces, in-Built Games, 15 Days Battery-Pink  ","2,999",4.3,"₹2,999",CrossBeats
Zaha New Generation Digital Square Watch for Boys & Girls & Kids (Pink)  ,110,1.5,₹110,Generic
Yuva Analog Black Dial Men's Watch-NL7924SL04/NP7924SL04  ,975,4.1,₹975,Sonata
Opus Automatic Watch Mechanical Wrist Watch for Men Octagonal Case with Silicone Band Self-Wind Business Watch for Men  ,"2,990",4.0,"₹2,990",ALTURA
Analog Gold Dial Men's Watch-NL1650YM04/NP1650YM04  ,"2,815",4.4,"₹2,815",Titan
Digital Men's Watch (Black Colored Strap)  ,329,3.7,₹329,Scarter
Edifice Chronograph Black Dial Men's Watch - EFR-526L-1AVUDF (EX096)  ,"6,494",4.3,"₹6,494",Casio
White Dial Dora Love Watch Series Analogue Girl's Kids Watch  ,189,3.6,₹189,SWADESI STUFF
New Fastrack Reflex Beat+ 1.69” UltraVU Display|500 Nits Brightness|60 Sports Modes|24*7 Heart Rate Monitor|SpO2 Monitor|Sleep Tracker|IP68 Water Resistant|Music & Camera Control  ,"1,694",3.9,"₹1,694",Fastrack
Brand A Army Shockproof Waterproof Digital Sports Black Sunglass with Black Baseball Cap Watch for Mens Kids Sports Watch with Cap for Boys - Military Army Watch for Men  ,321,3.7,₹321,SELLORIA
Analog Blue Dial Men's Watch-NL3117SL04/NP3117SL04  ,"1,400",4.3,"₹1,400",Fastrack
Digital Boy's & Men's Watch (Multicolour Dial Multi Colored Strap)  ,231,3.9,₹231,ZUPERIA
Analog Gold Dial Women's Watch-TW000Q810  ,"3,075",4.4,"₹3,075",TIMEX
Anolog Blue Dial Men's Watch-SS-GR825-BLK-BLU  ,139,2.6,₹139,SWISSTYLE
"Fire-Boltt Ninja 3 1.83"" Display Smartwatch Full Touch with 100+ Sports Modes with IP68, Sp02 Tracking, Over 100 Cloud Based Watch Faces  ","1,299",4.2,"₹1,299",Fire-Boltt
"SENS NUTON 1 with 1.7 IPS Display, Orbiter, 5ATM & 150+ Watch Faces & Free Additional Strap (Matte Black)  ","1,099",3.9,"₹1,099",SENS
Enticer Analog Black Dial Men's Watch-MTP-VD01GL-1EVUDF  ,"2,498",4.4,"₹2,498",Casio
Analog-Digital Men's Watch (Dial Colored Strap)  ,"17,927",4.2,"₹17,927",FEICE
Analog Black Dial Men's Watch-FS5653  ,"9,495",4.3,"₹9,495",Fossil
Nate Chronograph Grey Dial Men's Watch - JR1437  ,"8,997",4.3,"₹8,997",Fossil
"Apple Watch Series 8 [GPS 41 mm] Smart Watch w/Starlight Aluminium Case with Starlight Sport Band. Fitness Tracker, Blood Oxygen & ECG Apps, Always-On Retina Display, Water Resistant  ","43,900",4.6,"₹43,900",Apple
Formal Analog Men's Watch (Black Dial Multi Colored Strap)  ,389,3.4,₹389,VILLS LAURRENS
Barbie Digital Unisex Child Watch (Pink Dial Pink Colored Strap)  ,199,3.3,₹199,Barbie
"CrossBeats Spectra max Super Retina AMOLED Always on Display Smart Watch, 1.81 Inch 368 * 448 Resolution Smartwatch, AI ENC BT Calling, Crown Controls, 250+ Watch Faces, 150+ Sports Modes-Blue  ","3,999",4.3,"₹3,999",CrossBeats
Nakoda Analog Black Dial- Pu Strap & Black King Bracelet Combo Set for Men & Watch for Boys Pair of Watch and Bracelet  ,165,3.1,₹165,Generic
"Gen 6 Smartwatch with AMOLED Screen, Snapdragon 4100+ Wear Platform, Wear OS by Google, Google Assistant, SpO2, Wellness Features and Smartphone Notifications  ","24,995",4.0,"₹24,995",Fossil
Karishma Analog Black Dial Men's Watch-NL1639SM02/NN1639SM02  ,"1,995",4.3,"₹1,995",Titan
Griffed Mini Leather Watch - DZ4604  ,"19,995",4.0,"₹19,995",Diesel
"New Smartwatch Max Pro Bold Advanced Bluetooth calling with AAC Speakers & Largest 1.81"" HD Display, AI Voice Assistant, Premium Metal Body,100+ Sports&Watch Faces, HRM, SpO2 & Sleep Monitoring  ","2,599",3.8,"₹2,599",Maxima
Analogue Men's Watch (Pack of 3) (Multicolored Dial Multicolored Colored Strap)  ,355,3.5,₹355,Acnos
Analog-Digital Men's Watch (Black Dial Colored Strap)  ,"2,827",4.3,"₹2,827",Yihou
Enticer Analog Blue Dial Men's Watch-MTP-VD01D-2EVUDF (A1364)  ,"2,198",4.4,"₹2,198",Casio
Analog Black Dial Men's Watch-TW000U914  ,"2,865",4.4,"₹2,865",TIMEX
Boy's Avenger Printed Analog Watch and King Bracelet Combo (Black)  ,249,3.6,₹249,CERO
"Smart Watch for Men & Women - ID116 Latest Bluetooth Phone Watch 1.3"" LED with Daily Activity Tracker, Heart Rate Sensor, BP Monitor, Sports Watch for All Boys & Girls - Black  ",479,3.8,₹479,Boxing
Digital Grey Dial Children's Watch-NLC3002PV03/NPC3002PV03  ,940,4.2,₹940,Zoop
Chronograph Men's Watch (Black Dial)  ,"12,995",4.3,"₹12,995",Armani Exchange
Enticer Analog Blue Dial Men's Watch-MTP-VD01D-2EVUDF (A1364)  ,"2,198",4.4,"₹2,198",Casio
Minimalist Analog Blue Dial Men's Watch-FS5942  ,"11,995",3.8,"₹11,995",Fossil
Analog Black Dial Men's Watch-TW000U914  ,"2,865",4.4,"₹2,865",TIMEX
Analog Silver Dial Men's Watch-7140SL01/NP7140SL01  ,"2,499",3.6,"₹2,499",Sonata
"Smart Watch for Men & Women - ID116 Latest Bluetooth Phone Watch 1.3"" LED with Daily Activity Tracker, Heart Rate Sensor, BP Monitor, Sports Watch for All Boys & Girls - Black  ",479,3.8,₹479,Boxing
Hip Hop Analog White Dial Women's Watch-NL9827PP01/NP9827PP01  ,"1,960",4.3,"₹1,960",Fastrack
Analog Silver Dial Men's Watch-TW000U908  ,"2,096",3.9,"₹2,096",TIMEX
Magnetic Charging Cable Compatible with Dizo Watch 2/Watch 2 Sport/Dizo Watch S/Dizo Watch D (Watch 2/Watch D/S)  ,299,5.0,₹299,ZOVC
Brand A Army Shockproof Waterproof Digital Sports Black Sunglass with Black Baseball Cap Watch for Mens Kids Sports Watch with Cap for Boys - Military Army Watch for Men  ,321,3.7,₹321,SELLORIA
"Talk S with 1.78"" AMOLED Display|Advanced BT Calling|Music Storage with Wireless Audio Connect|100+ Sports Modes|Animated Watchfaces|5 Days Battery|IP68 Water Resistant|Stress & Mood Monitor  ","8,995",4.0,"₹8,995",Titan
Digital Men's Watch (Black Colored Strap)  ,329,3.7,₹329,Scarter
Men's Digital Sports Watch 50m Waterproof LED Military Multifunction Smart Watch Stopwatch Countdown Auto Date Alarm - 1251  ,,4.0,,SKMEI
IZU Kids Cartoon Character Waterproof Superhero Theme Waterproof Touch Button Silicone Smart Digital LED Band Bracelet Watch (Black) -Pack of 4  ,499,3.2,₹499,IZU
Analog Silver Dial Children's Watch-NLC4006PP02/NPC4006PP02  ,775,4.5,₹775,Zoop
Watches: The History of Time: Signature Timepieces of The Most Influential People  ,0,3.6,₹0,Samuel Johnson
Economy Analog Black Dial Men's Watch-NM3039SL02 / NL3039SL02/NP3039SL02  ,"1,895",4.1,"₹1,895",Fastrack
Super Fibre Digital Grey Dial Men's Watch-NL87012PP03/NP87012PP03  ,585,4.1,₹585,Sonata
